{
  "schemaVersion": "2026-07-01",
  "slug": "remote-r2-github-mrai7rvl-6ab1b1",
  "version": "0.1.0",
  "license": "MIT",
  "categories": [
    "testing",
    "marketplace"
  ],
  "tags": [
    "xapi",
    "skill-market",
    "r2",
    "github"
  ],
  "supportedAgents": [
    "codex",
    "claude-code",
    "universal"
  ],
  "riskLevel": "low",
  "xapiDependencies": [
    {
      "type": "apiService",
      "serviceSlug": "xapi-skill-market",
      "required": false,
      "purpose": "Optional marketplace status checks during operator-led validation."
    }
  ],
  "permissions": {
    "network": [
      "xapi.to",
      "api.github.com"
    ],
    "writesExternalState": false,
    "mayChargeUserBalance": false,
    "handlesPersonalData": false
  },
  "examples": [
    {
      "title": "Validate publish pipeline",
      "prompt": "Check whether the latest smoke-test skill has been stored in R2 and published to the public GitHub repo."
    }
  ]
}